Dataset: /mnt/disk2/nhatnc/res/scalogram_fewshot/pd_fewshot/scalogram_images
Split: 30/class for val, 30/class for test, rest for train
Computing mean/std on training set...
  Mean: ['0.040', '0.060', '0.623']
  Std:  ['0.177', '0.205', '0.156']
Loaded: Train=171, Val=90, Test=90
initialization method [normal]
Epoch 1/100: 100%|█████████████████████████████████████████████████████████████████████████████████████████████████████████| 100/100 [00:02<00:00, 34.49it/s, loss=1.1120]
Epoch 1: Loss=1.0669, Val Acc=0.4800
  → Best model saved (0.4800)
Epoch 2/100: 100%|█████████████████████████████████████████████████████████████████████████████████████████████████████████| 100/100 [00:02<00:00, 43.82it/s, loss=0.3691]
Epoch 2: Loss=0.8656, Val Acc=0.5644
  → Best model saved (0.5644)
Epoch 3/100: 100%|█████████████████████████████████████████████████████████████████████████████████████████████████████████| 100/100 [00:02<00:00, 43.60it/s, loss=0.2235]
Epoch 3: Loss=0.6374, Val Acc=0.5600
Epoch 4/100: 100%|█████████████████████████████████████████████████████████████████████████████████████████████████████████| 100/100 [00:02<00:00, 40.34it/s, loss=1.1330]
Epoch 4: Loss=0.5338, Val Acc=0.6844
  → Best model saved (0.6844)
Epoch 5/100: 100%|█████████████████████████████████████████████████████████████████████████████████████████████████████████| 100/100 [00:02<00:00, 42.44it/s, loss=0.3960]
Epoch 5: Loss=0.4942, Val Acc=0.6978
  → Best model saved (0.6978)
Epoch 6/100: 100%|█████████████████████████████████████████████████████████████████████████████████████████████████████████| 100/100 [00:02<00:00, 45.78it/s, loss=0.5256]
Epoch 6: Loss=0.3848, Val Acc=0.7378
  → Best model saved (0.7378)
Epoch 7/100: 100%|█████████████████████████████████████████████████████████████████████████████████████████████████████████| 100/100 [00:02<00:00, 46.70it/s, loss=0.2687]
Epoch 7: Loss=0.3136, Val Acc=0.7289
Epoch 8/100: 100%|█████████████████████████████████████████████████████████████████████████████████████████████████████████| 100/100 [00:02<00:00, 42.30it/s, loss=0.2275]
Epoch 8: Loss=0.3489, Val Acc=0.8178
  → Best model saved (0.8178)
Epoch 9/100: 100%|█████████████████████████████████████████████████████████████████████████████████████████████████████████| 100/100 [00:02<00:00, 40.57it/s, loss=0.3657]
Epoch 9: Loss=0.2999, Val Acc=0.8222
  → Best model saved (0.8222)
Epoch 10/100: 100%|████████████████████████████████████████████████████████████████████████████████████████████████████████| 100/100 [00:02<00:00, 43.99it/s, loss=0.1973]
Epoch 10: Loss=0.2927, Val Acc=0.7422
Epoch 11/100: 100%|████████████████████████████████████████████████████████████████████████████████████████████████████████| 100/100 [00:02<00:00, 47.50it/s, loss=0.2871]
Epoch 11: Loss=0.2499, Val Acc=0.7956
Epoch 12/100: 100%|████████████████████████████████████████████████████████████████████████████████████████████████████████| 100/100 [00:02<00:00, 44.19it/s, loss=0.2091]
Epoch 12: Loss=0.2284, Val Acc=0.8356
  → Best model saved (0.8356)
Epoch 13/100: 100%|████████████████████████████████████████████████████████████████████████████████████████████████████████| 100/100 [00:02<00:00, 43.83it/s, loss=0.1873]
Epoch 13: Loss=0.2398, Val Acc=0.8311
Epoch 14/100: 100%|████████████████████████████████████████████████████████████████████████████████████████████████████████| 100/100 [00:02<00:00, 45.69it/s, loss=0.2236]
Epoch 14: Loss=0.2373, Val Acc=0.8000
Epoch 15/100: 100%|████████████████████████████████████████████████████████████████████████████████████████████████████████| 100/100 [00:02<00:00, 44.13it/s, loss=0.1871]
Epoch 15: Loss=0.2178, Val Acc=0.8311
Epoch 16/100: 100%|████████████████████████████████████████████████████████████████████████████████████████████████████████| 100/100 [00:02<00:00, 43.55it/s, loss=0.2879]
Epoch 16: Loss=0.2363, Val Acc=0.8711
  → Best model saved (0.8711)
Epoch 17/100: 100%|████████████████████████████████████████████████████████████████████████████████████████████████████████| 100/100 [00:02<00:00, 49.38it/s, loss=0.2255]
Epoch 17: Loss=0.2074, Val Acc=0.7822
Epoch 18/100: 100%|████████████████████████████████████████████████████████████████████████████████████████████████████████| 100/100 [00:02<00:00, 46.80it/s, loss=0.1860]
Epoch 18: Loss=0.2201, Val Acc=0.8311
Epoch 19/100: 100%|████████████████████████████████████████████████████████████████████████████████████████████████████████| 100/100 [00:02<00:00, 44.49it/s, loss=0.2002]
Epoch 19: Loss=0.2148, Val Acc=0.8756
  → Best model saved (0.8756)
Epoch 20/100: 100%|████████████████████████████████████████████████████████████████████████████████████████████████████████| 100/100 [00:02<00:00, 43.32it/s, loss=0.2263]
Epoch 20: Loss=0.2196, Val Acc=0.8667
Epoch 21/100: 100%|████████████████████████████████████████████████████████████████████████████████████████████████████████| 100/100 [00:02<00:00, 44.21it/s, loss=0.1864]
Epoch 21: Loss=0.2184, Val Acc=0.8222
Epoch 22/100: 100%|████████████████████████████████████████████████████████████████████████████████████████████████████████| 100/100 [00:02<00:00, 42.74it/s, loss=0.2282]
Epoch 22: Loss=0.2128, Val Acc=0.8667
Epoch 23/100: 100%|████████████████████████████████████████████████████████████████████████████████████████████████████████| 100/100 [00:02<00:00, 46.64it/s, loss=0.1865]
Epoch 23: Loss=0.2223, Val Acc=0.8578
Epoch 24/100: 100%|████████████████████████████████████████████████████████████████████████████████████████████████████████| 100/100 [00:02<00:00, 40.96it/s, loss=0.1905]
Epoch 24: Loss=0.2076, Val Acc=0.8044
Epoch 25/100: 100%|████████████████████████████████████████████████████████████████████████████████████████████████████████| 100/100 [00:02<00:00, 45.19it/s, loss=0.1857]
Epoch 25: Loss=0.2100, Val Acc=0.8044
Epoch 26/100: 100%|████████████████████████████████████████████████████████████████████████████████████████████████████████| 100/100 [00:02<00:00, 43.00it/s, loss=0.1936]
Epoch 26: Loss=0.2199, Val Acc=0.8044
Epoch 27/100: 100%|████████████████████████████████████████████████████████████████████████████████████████████████████████| 100/100 [00:02<00:00, 43.54it/s, loss=0.1869]
Epoch 27: Loss=0.2151, Val Acc=0.8311
Epoch 28/100: 100%|████████████████████████████████████████████████████████████████████████████████████████████████████████| 100/100 [00:02<00:00, 44.15it/s, loss=0.1868]
Epoch 28: Loss=0.2087, Val Acc=0.8533
Epoch 29/100: 100%|████████████████████████████████████████████████████████████████████████████████████████████████████████| 100/100 [00:02<00:00, 43.74it/s, loss=0.1856]
Epoch 29: Loss=0.2161, Val Acc=0.8044
Epoch 30/100: 100%|████████████████████████████████████████████████████████████████████████████████████████████████████████| 100/100 [00:02<00:00, 49.09it/s, loss=0.2026]
Epoch 30: Loss=0.2073, Val Acc=0.8711
Epoch 31/100: 100%|████████████████████████████████████████████████████████████████████████████████████████████████████████| 100/100 [00:02<00:00, 43.75it/s, loss=0.1876]
Epoch 31: Loss=0.1980, Val Acc=0.8622
Epoch 32/100: 100%|████████████████████████████████████████████████████████████████████████████████████████████████████████| 100/100 [00:02<00:00, 41.26it/s, loss=0.3074]
Epoch 32: Loss=0.2103, Val Acc=0.8756
Epoch 33/100: 100%|████████████████████████████████████████████████████████████████████████████████████████████████████████| 100/100 [00:02<00:00, 42.11it/s, loss=0.2394]
Epoch 33: Loss=0.2020, Val Acc=0.8711
Epoch 34/100: 100%|████████████████████████████████████████████████████████████████████████████████████████████████████████| 100/100 [00:02<00:00, 41.43it/s, loss=0.1892]
Epoch 34: Loss=0.2014, Val Acc=0.8444
Epoch 35/100: 100%|████████████████████████████████████████████████████████████████████████████████████████████████████████| 100/100 [00:02<00:00, 42.02it/s, loss=0.1863]
Epoch 35: Loss=0.2163, Val Acc=0.7911
Epoch 36/100: 100%|████████████████████████████████████████████████████████████████████████████████████████████████████████| 100/100 [00:02<00:00, 42.21it/s, loss=0.1947]
Epoch 36: Loss=0.2068, Val Acc=0.8667
Epoch 37/100: 100%|████████████████████████████████████████████████████████████████████████████████████████████████████████| 100/100 [00:02<00:00, 42.76it/s, loss=0.2254]
Epoch 37: Loss=0.2145, Val Acc=0.8533
Epoch 38/100: 100%|████████████████████████████████████████████████████████████████████████████████████████████████████████| 100/100 [00:02<00:00, 42.09it/s, loss=0.2516]
Epoch 38: Loss=0.2099, Val Acc=0.8711
Epoch 39/100: 100%|████████████████████████████████████████████████████████████████████████████████████████████████████████| 100/100 [00:02<00:00, 45.97it/s, loss=1.0097]
Epoch 39: Loss=0.2181, Val Acc=0.8667
Epoch 40/100: 100%|████████████████████████████████████████████████████████████████████████████████████████████████████████| 100/100 [00:02<00:00, 48.02it/s, loss=0.2119]
Epoch 40: Loss=0.2131, Val Acc=0.8711
Epoch 41/100: 100%|████████████████████████████████████████████████████████████████████████████████████████████████████████| 100/100 [00:02<00:00, 45.08it/s, loss=0.1884]
Epoch 41: Loss=0.2109, Val Acc=0.8311
Epoch 42/100: 100%|████████████████████████████████████████████████████████████████████████████████████████████████████████| 100/100 [00:02<00:00, 45.96it/s, loss=0.1916]
Epoch 42: Loss=0.2075, Val Acc=0.8667
Epoch 43/100: 100%|████████████████████████████████████████████████████████████████████████████████████████████████████████| 100/100 [00:02<00:00, 44.05it/s, loss=0.2092]
Epoch 43: Loss=0.2071, Val Acc=0.8711
Epoch 44/100: 100%|████████████████████████████████████████████████████████████████████████████████████████████████████████| 100/100 [00:02<00:00, 48.63it/s, loss=0.1974]
Epoch 44: Loss=0.2002, Val Acc=0.8622
Epoch 45/100: 100%|████████████████████████████████████████████████████████████████████████████████████████████████████████| 100/100 [00:02<00:00, 43.31it/s, loss=0.1917]
Epoch 45: Loss=0.2054, Val Acc=0.8667
Epoch 46/100: 100%|████████████████████████████████████████████████████████████████████████████████████████████████████████| 100/100 [00:02<00:00, 42.99it/s, loss=0.1855]
Epoch 46: Loss=0.2152, Val Acc=0.8667
Epoch 47/100: 100%|████████████████████████████████████████████████████████████████████████████████████████████████████████| 100/100 [00:02<00:00, 43.87it/s, loss=0.1862]
Epoch 47: Loss=0.2054, Val Acc=0.8400
Epoch 48/100: 100%|████████████████████████████████████████████████████████████████████████████████████████████████████████| 100/100 [00:02<00:00, 42.30it/s, loss=0.2723]
Epoch 48: Loss=0.2187, Val Acc=0.8711
Epoch 49/100: 100%|████████████████████████████████████████████████████████████████████████████████████████████████████████| 100/100 [00:02<00:00, 43.30it/s, loss=0.1883]
Epoch 49: Loss=0.2097, Val Acc=0.8000
Epoch 50/100: 100%|████████████████████████████████████████████████████████████████████████████████████████████████████████| 100/100 [00:02<00:00, 47.46it/s, loss=0.1891]
Epoch 50: Loss=0.2008, Val Acc=0.8356
Epoch 51/100: 100%|████████████████████████████████████████████████████████████████████████████████████████████████████████| 100/100 [00:02<00:00, 40.45it/s, loss=0.2825]
Epoch 51: Loss=0.2117, Val Acc=0.8711
Epoch 52/100: 100%|████████████████████████████████████████████████████████████████████████████████████████████████████████| 100/100 [00:02<00:00, 41.53it/s, loss=0.2573]
Epoch 52: Loss=0.2126, Val Acc=0.8667
Epoch 53/100: 100%|████████████████████████████████████████████████████████████████████████████████████████████████████████| 100/100 [00:02<00:00, 42.61it/s, loss=0.1868]
Epoch 53: Loss=0.2050, Val Acc=0.8622
Epoch 54/100: 100%|████████████████████████████████████████████████████████████████████████████████████████████████████████| 100/100 [00:02<00:00, 43.92it/s, loss=0.1957]
Epoch 54: Loss=0.2039, Val Acc=0.8400
Epoch 55/100: 100%|████████████████████████████████████████████████████████████████████████████████████████████████████████| 100/100 [00:02<00:00, 41.80it/s, loss=0.1873]
Epoch 55: Loss=0.2093, Val Acc=0.8667
Epoch 56/100: 100%|████████████████████████████████████████████████████████████████████████████████████████████████████████| 100/100 [00:02<00:00, 45.26it/s, loss=0.2124]
Epoch 56: Loss=0.2052, Val Acc=0.8711
Epoch 57/100: 100%|████████████████████████████████████████████████████████████████████████████████████████████████████████| 100/100 [00:02<00:00, 43.61it/s, loss=0.1916]
Epoch 57: Loss=0.2209, Val Acc=0.8489
Epoch 58/100: 100%|████████████████████████████████████████████████████████████████████████████████████████████████████████| 100/100 [00:01<00:00, 50.53it/s, loss=0.1874]
Epoch 58: Loss=0.2057, Val Acc=0.8311
Epoch 59/100: 100%|████████████████████████████████████████████████████████████████████████████████████████████████████████| 100/100 [00:02<00:00, 43.34it/s, loss=0.1859]
Epoch 59: Loss=0.2020, Val Acc=0.8000
Epoch 60/100: 100%|████████████████████████████████████████████████████████████████████████████████████████████████████████| 100/100 [00:02<00:00, 41.85it/s, loss=0.1974]
Epoch 60: Loss=0.2029, Val Acc=0.8667
Epoch 61/100: 100%|████████████████████████████████████████████████████████████████████████████████████████████████████████| 100/100 [00:02<00:00, 43.56it/s, loss=0.2145]
Epoch 61: Loss=0.2064, Val Acc=0.8578
Epoch 62/100: 100%|████████████████████████████████████████████████████████████████████████████████████████████████████████| 100/100 [00:02<00:00, 43.94it/s, loss=0.1889]
Epoch 62: Loss=0.2104, Val Acc=0.8178
Epoch 63/100: 100%|████████████████████████████████████████████████████████████████████████████████████████████████████████| 100/100 [00:02<00:00, 43.06it/s, loss=0.1865]
Epoch 63: Loss=0.2096, Val Acc=0.8622
Epoch 64/100: 100%|████████████████████████████████████████████████████████████████████████████████████████████████████████| 100/100 [00:02<00:00, 44.10it/s, loss=0.1860]
Epoch 64: Loss=0.2058, Val Acc=0.8356
Epoch 65/100: 100%|████████████████████████████████████████████████████████████████████████████████████████████████████████| 100/100 [00:02<00:00, 46.22it/s, loss=0.1862]
Epoch 65: Loss=0.2099, Val Acc=0.8622
Epoch 66/100: 100%|████████████████████████████████████████████████████████████████████████████████████████████████████████| 100/100 [00:02<00:00, 49.44it/s, loss=0.1878]
Epoch 66: Loss=0.2085, Val Acc=0.8356
Epoch 67/100: 100%|████████████████████████████████████████████████████████████████████████████████████████████████████████| 100/100 [00:02<00:00, 45.84it/s, loss=0.1980]
Epoch 67: Loss=0.2050, Val Acc=0.8667
Epoch 68/100: 100%|████████████████████████████████████████████████████████████████████████████████████████████████████████| 100/100 [00:01<00:00, 50.17it/s, loss=0.1884]
Epoch 68: Loss=0.2085, Val Acc=0.8044
Epoch 69/100: 100%|████████████████████████████████████████████████████████████████████████████████████████████████████████| 100/100 [00:02<00:00, 46.52it/s, loss=0.2210]
Epoch 69: Loss=0.2156, Val Acc=0.8489
Epoch 70/100: 100%|████████████████████████████████████████████████████████████████████████████████████████████████████████| 100/100 [00:02<00:00, 44.08it/s, loss=0.1893]
Epoch 70: Loss=0.2086, Val Acc=0.8756
Epoch 71/100: 100%|████████████████████████████████████████████████████████████████████████████████████████████████████████| 100/100 [00:02<00:00, 43.59it/s, loss=0.2302]
Epoch 71: Loss=0.2078, Val Acc=0.8756
Epoch 72/100: 100%|████████████████████████████████████████████████████████████████████████████████████████████████████████| 100/100 [00:02<00:00, 44.98it/s, loss=0.1908]
Epoch 72: Loss=0.2075, Val Acc=0.8667
Epoch 73/100: 100%|████████████████████████████████████████████████████████████████████████████████████████████████████████| 100/100 [00:02<00:00, 44.33it/s, loss=0.1907]
Epoch 73: Loss=0.2067, Val Acc=0.8667
Epoch 74/100: 100%|████████████████████████████████████████████████████████████████████████████████████████████████████████| 100/100 [00:02<00:00, 40.92it/s, loss=0.2089]
Epoch 74: Loss=0.2144, Val Acc=0.8711
Epoch 75/100: 100%|████████████████████████████████████████████████████████████████████████████████████████████████████████| 100/100 [00:02<00:00, 47.52it/s, loss=0.2478]
Epoch 75: Loss=0.2056, Val Acc=0.8311
Epoch 76/100: 100%|████████████████████████████████████████████████████████████████████████████████████████████████████████| 100/100 [00:02<00:00, 42.24it/s, loss=0.1897]
Epoch 76: Loss=0.2118, Val Acc=0.8711
Epoch 77/100: 100%|████████████████████████████████████████████████████████████████████████████████████████████████████████| 100/100 [00:02<00:00, 41.12it/s, loss=0.1882]
Epoch 77: Loss=0.2214, Val Acc=0.8178
Epoch 78/100: 100%|████████████████████████████████████████████████████████████████████████████████████████████████████████| 100/100 [00:02<00:00, 48.36it/s, loss=0.1872]
Epoch 78: Loss=0.2007, Val Acc=0.8400
Epoch 79/100: 100%|████████████████████████████████████████████████████████████████████████████████████████████████████████| 100/100 [00:02<00:00, 48.23it/s, loss=0.1922]
Epoch 79: Loss=0.2043, Val Acc=0.8667
Epoch 80/100: 100%|████████████████████████████████████████████████████████████████████████████████████████████████████████| 100/100 [00:02<00:00, 42.80it/s, loss=0.1881]
Epoch 80: Loss=0.2140, Val Acc=0.8311
Epoch 81/100: 100%|████████████████████████████████████████████████████████████████████████████████████████████████████████| 100/100 [00:02<00:00, 47.59it/s, loss=0.1863]
Epoch 81: Loss=0.1996, Val Acc=0.8133
Epoch 82/100: 100%|████████████████████████████████████████████████████████████████████████████████████████████████████████| 100/100 [00:02<00:00, 46.82it/s, loss=0.1892]
Epoch 82: Loss=0.2108, Val Acc=0.8400
Epoch 83/100: 100%|████████████████████████████████████████████████████████████████████████████████████████████████████████| 100/100 [00:02<00:00, 42.94it/s, loss=0.1872]
Epoch 83: Loss=0.2067, Val Acc=0.8444
Epoch 84/100: 100%|████████████████████████████████████████████████████████████████████████████████████████████████████████| 100/100 [00:02<00:00, 47.57it/s, loss=0.2034]
Epoch 84: Loss=0.2044, Val Acc=0.8667
Epoch 85/100: 100%|████████████████████████████████████████████████████████████████████████████████████████████████████████| 100/100 [00:02<00:00, 44.08it/s, loss=0.1882]
Epoch 85: Loss=0.2132, Val Acc=0.8222
Epoch 86/100: 100%|████████████████████████████████████████████████████████████████████████████████████████████████████████| 100/100 [00:02<00:00, 44.24it/s, loss=0.1872]
Epoch 86: Loss=0.2081, Val Acc=0.8267
Epoch 87/100: 100%|████████████████████████████████████████████████████████████████████████████████████████████████████████| 100/100 [00:02<00:00, 45.47it/s, loss=0.1869]
Epoch 87: Loss=0.2083, Val Acc=0.8622
Epoch 88/100: 100%|████████████████████████████████████████████████████████████████████████████████████████████████████████| 100/100 [00:02<00:00, 43.70it/s, loss=0.2170]
Epoch 88: Loss=0.2051, Val Acc=0.8711
Epoch 89/100: 100%|████████████████████████████████████████████████████████████████████████████████████████████████████████| 100/100 [00:02<00:00, 45.33it/s, loss=0.2011]
Epoch 89: Loss=0.2098, Val Acc=0.8400
Epoch 90/100: 100%|████████████████████████████████████████████████████████████████████████████████████████████████████████| 100/100 [00:02<00:00, 43.42it/s, loss=0.1849]
Epoch 90: Loss=0.2026, Val Acc=0.8667
Epoch 91/100: 100%|████████████████████████████████████████████████████████████████████████████████████████████████████████| 100/100 [00:02<00:00, 43.20it/s, loss=0.1931]
Epoch 91: Loss=0.2067, Val Acc=0.8711
Epoch 92/100: 100%|████████████████████████████████████████████████████████████████████████████████████████████████████████| 100/100 [00:02<00:00, 43.82it/s, loss=0.1998]
Epoch 92: Loss=0.2086, Val Acc=0.8667
Epoch 93/100: 100%|████████████████████████████████████████████████████████████████████████████████████████████████████████| 100/100 [00:02<00:00, 45.65it/s, loss=0.1894]
Epoch 93: Loss=0.2013, Val Acc=0.8489
Epoch 94/100: 100%|████████████████████████████████████████████████████████████████████████████████████████████████████████| 100/100 [00:02<00:00, 44.21it/s, loss=0.1948]
Epoch 94: Loss=0.2189, Val Acc=0.8044
Epoch 95/100: 100%|████████████████████████████████████████████████████████████████████████████████████████████████████████| 100/100 [00:02<00:00, 41.54it/s, loss=0.2124]
Epoch 95: Loss=0.2121, Val Acc=0.8800
  → Best model saved (0.8800)
Epoch 96/100: 100%|████████████████████████████████████████████████████████████████████████████████████████████████████████| 100/100 [00:02<00:00, 44.07it/s, loss=0.1877]
Epoch 96: Loss=0.2144, Val Acc=0.8578
Epoch 97/100: 100%|████████████████████████████████████████████████████████████████████████████████████████████████████████| 100/100 [00:02<00:00, 44.18it/s, loss=0.1853]
Epoch 97: Loss=0.2038, Val Acc=0.8444
Epoch 98/100: 100%|████████████████████████████████████████████████████████████████████████████████████████████████████████| 100/100 [00:02<00:00, 47.05it/s, loss=0.1960]
Epoch 98: Loss=0.2008, Val Acc=0.8844
  → Best model saved (0.8844)
Epoch 99/100: 100%|████████████████████████████████████████████████████████████████████████████████████████████████████████| 100/100 [00:02<00:00, 43.13it/s, loss=0.1916]
Epoch 99: Loss=0.2164, Val Acc=0.8489
Epoch 100/100: 100%|███████████████████████████████████████████████████████████████████████████████████████████████████████| 100/100 [00:02<00:00, 44.03it/s, loss=0.1856]
Epoch 100: Loss=0.2062, Val Acc=0.8489

==================================================
Final Test: covamnet | 1-shot
150 episodes × 3 classes × 1 query = 450 predictions
==================================================
Testing: 100%|█████████████████████████████████████████████████████████████████████████████████████████████████████████████████████████| 150/150 [00:00<00:00, 261.06it/s]

Accuracy : 0.9111
Precision: 0.9286
Recall   : 0.9111
F1-Score : 0.9114
p-value  : 4.95e-149
Saved: results/confusion_matrix_covamnet_1shot_allsamples.png
Saved: results/tsne_covamnet_1shot_allsamples.png

Results logged to WandB and plots saved to results/
